Index,Dialogue
1,"HE: Hello!
GU: Hello!
HE: Did you eat breakfast?
GU: One bread, please!
HE: What kind of bread is it?
GU: It's anpan!
HE: It goes well with milk!
GU: I just drank it!
HE: That's amusing!
GU: This combination is good.
HE: I also like anpan.
GU: Is it tsubu or koshi?
HE: Is it the lower back?
GU: It's the same!
HE: The texture of the grains is a bit...!
GU: I understand, there are many arguments, aren't there?
HE: I'm not a big fan!
GU: It seems like I became someone who dislikes food without trying it.
HE: In the past?
GU: Yes, when I was little.
HE: When we were little, we tended to have more foods we disliked without even trying them.
GU: If the first impression is not good.
HE: I used to dislike things like green peppers.
GU: It's the same.
HE: But now I love it!
GU: Is it a change in taste?
HE: I think so.
GU: That's right, there's no other way.
HE: I'm willingly eating it.
GU: Me too."
2,"HE: Hello!
GU: Hello! 
HE: Do you have a favorite food? 
GU: 'Is it fried rice?' 
HE: Oh! 
GU: I like it so much that I make it myself. 
HE: 'Will it become separated?' 
GU: It happened! 
HE: Your practice is paying off! 
GU: In the beginning, already...! 
HE: Was it too much? 
GU: Continuously failing. 
HE: That's normal at first! 
GU: I was frustrated. 
HE: Did you get used to it? 
GU: Yes. And a wok, please. 
HE: Did you specifically buy it? 
GU: I went out of my way to buy it! 
HE: 'That's impressive; it looks heavy.' 
GU: It's hard when it rains. 
HE: 'Do you dance? Cool!' 
GU: It's no big deal! 
HE: 'But it suits you.' 
GU: Indeed, it is fun. 
HE: I also want to try eating it. 
GU: Is it the flaky one? 
HE: Yes!!! 
GU: I will make it someday! 
HE: Really!? 
GU: I will become a chef!!"
